lemma	pos	date	grouping	identifier	description	context	indexes_target_token	indexes_target_sentence	identifier_system	project	lang	user
ночь	NN	example	22	22_ночь_42026		Раз в год, в Святую ночь, получали голубую салоникскую ткань на одежду по десяти аршин на брата, отрезы муслина на тюрбаны и рубахи.	20:24	0:132	27982	sem_cluster	ru	ek.gavrishina
ночь	NN	example	22	22_ночь_23594		Однажды утром, не обнаружив в доме ни единой запечатанной поллитровки-- все было выпито в долгие ночи дождя и тоски,-- Алексей решил предпринять вылазку в местный торговый центр.	97:101	0:178	27969	sem_cluster	ru	ek.gavrishina
ночь	NN	example	22	22_ночь_32777		Наверное, сжигали по ночам, а пепел съедали, запивая дармовым кефиром.	21:26	0:70	27977	sem_cluster	ru	ek.gavrishina
ночь	NN	example	22	22_ночь_12265		Коротков же сказал-- звонить немедленно, в любое время дня и ночи.	61:65	0:66	27978	sem_cluster	ru	ek.gavrishina
ночь	NN	example	22	22_ночь_350		В дни итальянского Гран-при здесь происходит невероятное скопление фанов«Феррари» со всей планеты, которые с утра пятницы до ночи воскресенья терроризируют местных барменов и жителей городка громкими песнями и алыми дымовыми шашками.	125:129	0:233	27975	sem_cluster	ru	ek.gavrishina
ночь	NN	example	22	22_ночь_123731		Все время говорили взапуски о местных кокотках и о тех притонах, где эти messieurs du gouvernement проводили свои вечера и ночи.	123:127	0:128	27990	sem_cluster	ru	ek.gavrishina
ночь	NN	example	22	22_ночь_115068		По ночам весь горизонт облегали огни, в теплом душистом воздухе непрерывно звенели заунывные песни, потому что это было время покоса.	3:8	0:133	27960	sem_cluster	ru	ek.gavrishina
ночь	NN	example	22	22_ночь_71589		Однажды ночью Афанасию, когда он спал, привиделся чудесный сон.	8:13	0:63	27992	sem_cluster	ru	ek.gavrishina
ночь	NN	example	22	22_ночь_112465		Девка, середи ночи, у холостого мужчины, в таком наряде: о бесстыдница!	14:18	0:71	27963	sem_cluster	ru	ek.gavrishina
ночь	NN	example	22	22_ночь_106354		А Маяковский, смеясь, оглядывался на пропадавшие в ночь фигуры.	51:55	0:63	27967	sem_cluster	ru	ek.gavrishina
ночь	NN	example	22	22_ночь_134852		Еще хорошо, что хоть мережу-то вчера на ночь догадался поставить.	40:44	0:65	27993	sem_cluster	ru	ek.gavrishina
ночь	NN	example	22	22_ночь_81285		В центре Парижа, на Итальянском бульвере, во 2-м часу ночи, когда публика возвращалась из театров, было произведено дерзкое нападение апашей на автомобиль.	54:58	0:155	27974	sem_cluster	ru	ek.gavrishina
ночь	NN	example	22	22_ночь_103112		На ночь мне приготовляли постель на мягком диване в столовой, а для того чтобы я мог писать статьи или редактировать чужие произведения для нашего печатавшегося в тайной типографии журнала«Земля и воля», мне предоставлен был рабочий кабинет Корша, за исключением трех часов, когда он принимал в нем своих клиентов.	3:7	0:314	27981	sem_cluster	ru	ek.gavrishina
ночь	NN	example	22	22_ночь_72418		Ночью он очень горел, но спал, утром послали за доктором, он сейчас же сказал, что это скарлатина.	0:5	0:98	27980	sem_cluster	ru	ek.gavrishina
ночь	NN	example	22	22_ночь_84101		Ночью ему снились тёмные коридоры, в которых он блуждал одинокий, всеми покинутый, со слезами на глазах и коротким кинжалом у пояса.	0:5	0:132	27983	sem_cluster	ru	ek.gavrishina
ночь	NN	example	22	22_ночь_101458		Как затопишь у себя там, иди на всю ночь на лестницу и смотри.	36:40	0:62	27970	sem_cluster	ru	ek.gavrishina
ночь	NN	example	22	22_ночь_11965		Он узнал, что каждый рабочий в бригаде кровельщиков за эту ночь получит примерно столько, сколько ему не хватало на видеокамеру.	59:63	0:128	27984	sem_cluster	ru	ek.gavrishina
ночь	NN	example	22	22_ночь_31259		-- Да ты ведь сам ночью нам звонил,-- ответила бывшая жена, и тут же совместно с вождихой они взялись за очищение«ваксоновских стойл».	18:23	0:134	27968	sem_cluster	ru	ek.gavrishina
ночь	NN	example	22	22_ночь_24815		Хоть и работаю я с утра до ночи, но из-за алкоголя дело может кончиться для меня плохо.	27:31	0:87	27987	sem_cluster	ru	ek.gavrishina
ночь	NN	example	22	22_ночь_74431		После обеда я немного отдохнул в номере, но меня скоро разбудил Комаров и сообщил, что ночью мы вылетаем, куда-- он не сказал.	87:92	0:126	27991	sem_cluster	ru	ek.gavrishina
ночь	NN	example	22	22_ночь_111118		Да, это подлинная Аркадия... и эта ночь тоже какая-то аркадская: таинственно-мирная, ни листок не шелохнется, словно вся природа кругом затаила дыхание, порою лишь переводя дух томным вздохом, чтобы сейчас опят замереть.	35:39	0:220	27979	sem_cluster	ru	ek.gavrishina
ночь	NN	example	22	22_ночь_34115		Ближе к ночи приехал доктор наук Тамлер из новосибирского Академгородка-- худощавый дядечка в очках с веселыми детскими глазами.	8:12	0:128	27971	sem_cluster	ru	ek.gavrishina
ночь	NN	example	22	22_ночь_74100		А как шла Анфиса поздней ночью к себе домой, встал перед ней черт-черкес, загородил дорогу.	25:30	0:91	27976	sem_cluster	ru	ek.gavrishina
ночь	NN	example	22	22_ночь_24596		И, понимаешь, вчера ночью я видел, как на молочных цистернах фирмы«Болле» и автомашинах берлинской пожарной охраны вывозили на Восточный фронт стационарные батареи, входящие в систему ПВО Берлина.	20:25	0:196	27988	sem_cluster	ru	ek.gavrishina
ночь	NN	example	22	22_ночь_32378		Но ночью, с омерзением вслушиваясь в спускающееся комариное нытье, я чуял: нет.	3:8	0:79	27989	sem_cluster	ru	ek.gavrishina
ночь	NN	example	22	22_ночь_90169		Все товарищи мои сейчас с женами на теплых постелях, а я всю ночь лишь с соломой разговариваю»…	61:65	0:95	27994	sem_cluster	ru	ek.gavrishina
ночь	NN	example	22	22_ночь_41255		В ночь на 25 ноября 1741_г.	2:6	0:27	27964	sem_cluster	ru	ek.gavrishina
ночь	NN	example	22	22_ночь_115837		С этой минуты кашель, не переставая, начал меня мучить день и ночь, притом сухой и нестерпимый.	62:66	0:95	27986	sem_cluster	ru	ek.gavrishina
ночь	NN	example	22	22_ночь_14439		Разделение на«день» и«ночь» происходило скорее по привычке, чем по необходимости.	22:26	0:81	27965	sem_cluster	ru	ek.gavrishina
ночь	NN	example	22	22_ночь_56027		А я уже, оказывается, дома, читаю сыну на ночь«Малыш и Карлсон».	42:46	0:64	27962	sem_cluster	ru	ek.gavrishina
ночь	NN	example	22	22_ночь_76791		В темноте наступавшей ночи вспыхивали в городе пожары.	22:26	0:54	27966	sem_cluster	ru	ek.gavrishina
ночь	NN	example	22	22_ночь_130761		Я сам делал все, что мог бы велеть отроку: на охоте и на войне, днем и ночью, в жар летний и в холод зимний не знал покоя, не надеялся на посадников, не давал бедных и вдов в обиду сильным, сам смотрел за церковью и за божественным служением, за домашним порядком, конюшнею, охотою, ястребами и соколами.	71:76	0:304	27972	sem_cluster	ru	ek.gavrishina
ночь	NN	example	22	22_ночь_86464		С последнего совещания все участники должны были разойтись порознь, чтобы собраться к ночи около лодки.	86:90	0:103	27973	sem_cluster	ru	ek.gavrishina
ночь	NN	example	22	22_ночь_6360		Удивительно, но казах под навесом у винного магазина, напротив которого мы повернули вверх по переулку, по-прежнему торговал ночью велосипедами.	125:130	0:144	27961	sem_cluster	ru	ek.gavrishina
ночь	NN	example	22	22_ночь_61150		На 17-ое заснул во 2-м часу, а на 18-ое всю ночь на волос не уснул.	44:48	0:67	27985	sem_cluster	ru	ek.gavrishina
